[
  {
    "semantic_id": "layout.page_shell",
    "category": "layout",
    "role": "page_container",
    "slots": {
      "header": {
        "required": false,
        "type": "node"
      },
      "body": {
        "required": true,
        "type": "node"
      },
      "footer": {
        "required": false,
        "type": "node"
      }
    },
    "states": [
      "default"
    ],
    "behavior": [
      "contain"
    ],
    "constraints": {
      "max_primary_actions_per_region": 1
    },
    "interaction": {
      "events": [
        "on_render"
      ],
      "async": false
    },
    "accessibility": {
      "aria_role": "page_container",
      "keyboard": [
        "read_only"
      ],
      "live_region": "none"
    },
    "responsive": {
      "supports_compact": true,
      "breakpoints": [
        "xs",
        "sm",
        "md",
        "lg"
      ]
    },
    "i18n": {
      "text_direction": "both",
      "locale_sensitive_slots": [
        "label",
        "title",
        "message",
        "value"
      ],
      "truncation": "wrap"
    },
    "subcategory": "containers"
  },
  {
    "semantic_id": "layout.section",
    "category": "layout",
    "role": "content_group",
    "slots": {
      "title": {
        "required": false,
        "type": "text"
      },
      "body": {
        "required": true,
        "type": "node"
      },
      "actions": {
        "required": false,
        "type": "action"
      }
    },
    "states": [
      "default",
      "collapsed"
    ],
    "behavior": [
      "group",
      "optional_collapse"
    ],
    "constraints": {
      "max_actions": 3
    },
    "interaction": {
      "events": [
        "on_render"
      ],
      "async": false
    },
    "accessibility": {
      "aria_role": "content_group",
      "keyboard": [
        "read_only"
      ],
      "live_region": "none"
    },
    "responsive": {
      "supports_compact": true,
      "breakpoints": [
        "xs",
        "sm",
        "md",
        "lg"
      ]
    },
    "i18n": {
      "text_direction": "both",
      "locale_sensitive_slots": [
        "label",
        "title",
        "message",
        "value"
      ],
      "truncation": "wrap"
    },
    "subcategory": "containers"
  },
  {
    "semantic_id": "navigation.top_nav",
    "category": "navigation",
    "role": "global_navigation",
    "slots": {
      "brand": {
        "required": false,
        "type": "text"
      },
      "items": {
        "required": true,
        "type": "list",
        "repeatable": true
      },
      "actions": {
        "required": false,
        "type": "action"
      }
    },
    "states": [
      "default"
    ],
    "behavior": [
      "navigate"
    ],
    "constraints": {
      "max_items": 7
    },
    "interaction": {
      "events": [
        "on_interact"
      ],
      "async": false
    },
    "accessibility": {
      "aria_role": "global_navigation",
      "keyboard": [
        "tab_focus",
        "enter_activate"
      ],
      "live_region": "none"
    },
    "responsive": {
      "supports_compact": true,
      "breakpoints": [
        "xs",
        "sm",
        "md",
        "lg"
      ]
    },
    "i18n": {
      "text_direction": "both",
      "locale_sensitive_slots": [
        "label",
        "title",
        "message",
        "value"
      ],
      "truncation": "wrap"
    },
    "subcategory": "global"
  },
  {
    "semantic_id": "navigation.side_nav",
    "category": "navigation",
    "role": "context_navigation",
    "slots": {
      "items": {
        "required": true,
        "type": "list",
        "repeatable": true
      },
      "active_item": {
        "required": false,
        "type": "meta"
      }
    },
    "states": [
      "default",
      "collapsed"
    ],
    "behavior": [
      "navigate",
      "optional_collapse"
    ],
    "constraints": {
      "min_items": 1
    },
    "interaction": {
      "events": [
        "on_interact"
      ],
      "async": false
    },
    "accessibility": {
      "aria_role": "context_navigation",
      "keyboard": [
        "tab_focus",
        "enter_activate"
      ],
      "live_region": "none"
    },
    "responsive": {
      "supports_compact": true,
      "breakpoints": [
        "xs",
        "sm",
        "md",
        "lg"
      ]
    },
    "i18n": {
      "text_direction": "both",
      "locale_sensitive_slots": [
        "label",
        "title",
        "message",
        "value"
      ],
      "truncation": "wrap"
    },
    "subcategory": "local"
  },
  {
    "semantic_id": "input.text_field",
    "category": "input",
    "role": "data_entry",
    "slots": {
      "label": {
        "required": true,
        "type": "text"
      },
      "value": {
        "required": false,
        "type": "text"
      },
      "helper_text": {
        "required": false,
        "type": "text"
      },
      "error_text": {
        "required": false,
        "type": "text"
      }
    },
    "states": [
      "default",
      "focused",
      "error",
      "disabled"
    ],
    "behavior": [
      "editable",
      "validatable"
    ],
    "constraints": {
      "accessibility_label_required": true
    },
    "interaction": {
      "events": [
        "on_interact"
      ],
      "async": false
    },
    "accessibility": {
      "aria_role": "data_entry",
      "keyboard": [
        "tab_focus",
        "enter_activate"
      ],
      "live_region": "none"
    },
    "responsive": {
      "supports_compact": true,
      "breakpoints": [
        "xs",
        "sm",
        "md",
        "lg"
      ]
    },
    "i18n": {
      "text_direction": "both",
      "locale_sensitive_slots": [
        "label",
        "title",
        "message",
        "value"
      ],
      "truncation": "wrap"
    },
    "subcategory": "text_entry"
  },
  {
    "semantic_id": "input.select",
    "category": "input",
    "role": "data_selection",
    "slots": {
      "label": {
        "required": true,
        "type": "text"
      },
      "options": {
        "required": true,
        "type": "list",
        "repeatable": true
      },
      "helper_text": {
        "required": false,
        "type": "text"
      }
    },
    "states": [
      "default",
      "open",
      "error",
      "disabled"
    ],
    "behavior": [
      "select",
      "validatable"
    ],
    "constraints": {
      "min_options": 2
    },
    "interaction": {
      "events": [
        "on_interact"
      ],
      "async": false
    },
    "accessibility": {
      "aria_role": "data_selection",
      "keyboard": [
        "tab_focus",
        "enter_activate"
      ],
      "live_region": "none"
    },
    "responsive": {
      "supports_compact": true,
      "breakpoints": [
        "xs",
        "sm",
        "md",
        "lg"
      ]
    },
    "i18n": {
      "text_direction": "both",
      "locale_sensitive_slots": [
        "label",
        "title",
        "message",
        "value"
      ],
      "truncation": "wrap"
    },
    "subcategory": "selection"
  },
  {
    "semantic_id": "input.checkbox",
    "category": "input",
    "role": "boolean_choice",
    "slots": {
      "label": {
        "required": true,
        "type": "text"
      },
      "helper_text": {
        "required": false,
        "type": "text"
      }
    },
    "states": [
      "unchecked",
      "checked",
      "disabled"
    ],
    "behavior": [
      "toggle"
    ],
    "constraints": {},
    "interaction": {
      "events": [
        "on_interact"
      ],
      "async": false
    },
    "accessibility": {
      "aria_role": "boolean_choice",
      "keyboard": [
        "tab_focus",
        "enter_activate"
      ],
      "live_region": "none"
    },
    "responsive": {
      "supports_compact": true,
      "breakpoints": [
        "xs",
        "sm",
        "md",
        "lg"
      ]
    },
    "i18n": {
      "text_direction": "both",
      "locale_sensitive_slots": [
        "label",
        "title",
        "message",
        "value"
      ],
      "truncation": "wrap"
    },
    "subcategory": "selection"
  },
  {
    "semantic_id": "action.button_primary",
    "category": "action",
    "role": "primary_action",
    "slots": {
      "label": {
        "required": true,
        "type": "text"
      },
      "icon": {
        "required": false,
        "type": "media"
      }
    },
    "states": [
      "default",
      "loading",
      "disabled"
    ],
    "behavior": [
      "click"
    ],
    "constraints": {
      "max_per_region": 1
    },
    "interaction": {
      "events": [
        "on_interact"
      ],
      "async": true
    },
    "accessibility": {
      "aria_role": "primary_action",
      "keyboard": [
        "tab_focus",
        "enter_activate"
      ],
      "live_region": "none"
    },
    "responsive": {
      "supports_compact": true,
      "breakpoints": [
        "xs",
        "sm",
        "md",
        "lg"
      ]
    },
    "i18n": {
      "text_direction": "both",
      "locale_sensitive_slots": [
        "label",
        "title",
        "message",
        "value"
      ],
      "truncation": "wrap"
    },
    "subcategory": "buttons"
  },
  {
    "semantic_id": "action.button_secondary",
    "category": "action",
    "role": "secondary_action",
    "slots": {
      "label": {
        "required": true,
        "type": "text"
      },
      "icon": {
        "required": false,
        "type": "media"
      }
    },
    "states": [
      "default",
      "disabled"
    ],
    "behavior": [
      "click"
    ],
    "constraints": {},
    "interaction": {
      "events": [
        "on_interact"
      ],
      "async": false
    },
    "accessibility": {
      "aria_role": "secondary_action",
      "keyboard": [
        "tab_focus",
        "enter_activate"
      ],
      "live_region": "none"
    },
    "responsive": {
      "supports_compact": true,
      "breakpoints": [
        "xs",
        "sm",
        "md",
        "lg"
      ]
    },